{"schema_version":"axignal.sovereign-macro-strategy-workspace-fixtures/v0.1","task_id":"AX-GE2E-P13-T01","modules":["COUNTRY_SCOPE","SERIES_VINTAGE","PUBLIC_FINANCE","PUBLIC_INVESTMENT","POLICY_INSTITUTION","STRATEGY_WORKSPACE","SCENARIO_RISK","EXTERNAL_OUTCOME"],"classes":["HAPPY_PATH","INCOMPLETE_CONTEXT","REVOKED_DEPENDENCY","CROSS_TENANT","AUTHORITY_ESCALATION"],"expected_by_class":{"HAPPY_PATH":{"decision":"CANDIDATE","canonical_write":false,"external_action":false,"reason_code":"BOUNDED"},"INCOMPLETE_CONTEXT":{"decision":"REVIEW_REQUIRED","canonical_write":false,"external_action":false,"reason_code":"INCOMPLETE"},"REVOKED_DEPENDENCY":{"decision":"DENY","canonical_write":false,"external_action":false,"reason_code":"REVOKED"},"CROSS_TENANT":{"decision":"BLOCK","canonical_write":false,"external_action":false,"reason_code":"TENANT"},"AUTHORITY_ESCALATION":{"decision":"BLOCK","canonical_write":false,"external_action":false,"reason_code":"AUTHORITY"}}}